{
  "schema": "aicad.system-engineering-contract.v1",
  "systemId": "magic-wand-rev-a0",
  "revision": "2026-08-23-prototype-contract-2",
  "intendedUse": "Owner-authorized prototype bare-PCB fabrication of the frozen Rev A0 wand and, only after its open EDA/CAM gate passes, the independent receiver-effects board; prototype 3D printing and controlled cross-domain bring-up remain allowed, while PCBA and production remain locked.",
  "prohibitedUses": [
    "Production release or sale before every physical, target-firmware, receiver, PCBA, security and independent-review gate passes",
    "PCBA ordering before supplier and LCSC mapping, exact component substitutions and assembly data are independently reviewed",
    "Uploading or ordering any receiver-effects Gerber/drill/CAM created before the current power-width and return-path rework; every prior receiver-effects CAM package is REJECTED",
    "Connecting a battery before exact protected-cell selection and J2 harness pin-order and polarity verification",
    "Using conductive carbon-fiber or metal rod material inside or adjacent to the antenna keepout"
  ],
  "requirements": [
    {
      "id": "ELEC-001",
      "statement": "The authoritative wand PCB shall remain a 15.0 mm by 80.0 mm, 4-layer design with its frozen source identity and zero-error ERC/DRC tool results preserved before fabrication.",
      "verificationMethod": "Verify the bound KiCad board identity, then replay the pinned ERC/DRC and land-pattern checks after any electrical or layout change.",
      "subsystemIds": [
        "SUBSYS-ELECTRONICS"
      ],
      "gateIds": [
        "GATE-PCB-TOOL-001"
      ],
      "status": "tool_verified"
    },
    {
      "id": "FIT-001",
      "statement": "PCB, mounting holes, USB-C and press-to-arm controls shall align to the enclosure under case_x = pcb_x - 7.5 and case_z = pcb_y + 9.0 without reserved-volume collisions.",
      "verificationMethod": "Replay enclosure geometry QA and then inspect and measure the first printed article with the real PCB installed.",
      "subsystemIds": [
        "SUBSYS-ELECTRONICS",
        "SUBSYS-MECHANICAL"
      ],
      "gateIds": [
        "GATE-MECH-TOOL-001",
        "GATE-FIRST-ARTICLE-001"
      ],
      "status": "tool_verified"
    },
    {
      "id": "POWER-001",
      "statement": "The enclosure shall reserve a maximum 11 x 6 x 42 mm protected 1S LiPo with 10k NTC, service access, wire bend space and a J2 JST-SH 1.0 mm 3-pin BAT+/NTC/GND interface; J2 harness polarity shall be verified before connection.",
      "verificationMethod": "Replay reserved-volume QA, select the exact protected cell and harness, continuity-check J2 and physically fit the pack before energized bring-up.",
      "subsystemIds": [
        "SUBSYS-ELECTRONICS",
        "SUBSYS-MECHANICAL"
      ],
      "gateIds": [
        "GATE-MECH-TOOL-001",
        "GATE-FIRST-ARTICLE-001"
      ],
      "status": "tool_verified"
    },
    {
      "id": "HAPTIC-001",
      "statement": "The enclosure shall reserve a 10 mm diameter by 3.4 mm maximum coin LRA/ERM, retained nonconductively and wired to J3, while the selected actuator remains compatible with the DRV2605L configuration.",
      "verificationMethod": "Replay reserved-volume QA, review the selected actuator, physically fit it, then verify polarity, drive mode, current and thermal behavior on the first article.",
      "subsystemIds": [
        "SUBSYS-ELECTRONICS",
        "SUBSYS-MECHANICAL"
      ],
      "gateIds": [
        "GATE-MECH-TOOL-001",
        "GATE-FIRST-ARTICLE-001"
      ],
      "status": "tool_verified"
    },
    {
      "id": "RF-001",
      "statement": "The case z=5..30 mm antenna keepout shall contain no battery, metal fastener, dense filler or conductive rod, with at least 11 mm battery-to-keepout and 5 mm haptic-to-keepout separation in the current geometry.",
      "verificationMethod": "Replay geometry checks, inspect materials and assembly, then perform target-powered RF range and coexistence testing.",
      "subsystemIds": [
        "SUBSYS-ELECTRONICS",
        "SUBSYS-MECHANICAL",
        "SUBSYS-FIRMWARE"
      ],
      "gateIds": [
        "GATE-MECH-TOOL-001",
        "GATE-FIRST-ARTICLE-001"
      ],
      "status": "tool_verified"
    },
    {
      "id": "GESTURE-001",
      "statement": "The armed wand shall recognize TAP, TWIST_CW, TWIST_CCW, SWISH_LEFT, SWISH_RIGHT, THRUST, CIRCLE_CW and CIRCLE_CCW, reject stationary and ambiguous motion and enforce a 250 ms refractory period. GESTURE_EVENT shall use an explicitly authenticated negotiated profile: Legacy V1 is exactly 2 bytes and channel 0 only; Multichannel V2 is exactly 14 bytes and requires ARM_ACTIVE plus outer/payload device-session binding.",
      "verificationMethod": "Run gesture and exact-length/profile host vectors, then build and exercise both NINA-B302 targets, collect representative-user data, prove real BLE/AES-CCM interoperability and show that rejected, unauthenticated, disarmed or cross-device/session events produce no media or dangerous output.",
      "subsystemIds": [
        "SUBSYS-FIRMWARE",
        "SUBSYS-ELECTRONICS",
        "SUBSYS-RECEIVER"
      ],
      "gateIds": [
        "GATE-FW-HOST-001",
        "GATE-TARGET-FW-001",
        "GATE-RECEIVER-001"
      ],
      "status": "tool_verified"
    },
    {
      "id": "FAB-001",
      "statement": "The prototype fabrication upload shall contain only the verified Rev A0 bare-PCB Gerber/drill package for a 15 x 80 mm, 4-layer, 1.6 mm, 1 oz outer-copper board with black mask, white silkscreen, ENIG, tented vias and no impedance, edge-plating, castellations or gold fingers.",
      "verificationMethod": "Verify the bound ZIP identity and inspect the generated Gerber/drill set and JLC order parameters before upload.",
      "subsystemIds": [
        "SUBSYS-ELECTRONICS",
        "SUBSYS-MANUFACTURING"
      ],
      "gateIds": [
        "GATE-JLC-BARE-001"
      ],
      "status": "tool_verified"
    },
    {
      "id": "PHYSICAL-001",
      "statement": "The first printed enclosure and first assembled wand PCB shall be physically inspected for fit, shrink compensation, fastener torque, USB/button access, battery/haptic retention, current-limited bring-up, charge, thermal and RF behavior.",
      "verificationMethod": "Record first-article measurements, photographs, torque, current, temperature, charge, USB, haptic and RF results against this configuration.",
      "subsystemIds": [
        "SUBSYS-ELECTRONICS",
        "SUBSYS-MECHANICAL",
        "SUBSYS-FIRMWARE"
      ],
      "gateIds": [
        "GATE-FIRST-ARTICLE-001"
      ],
      "status": "defined"
    },
    {
      "id": "TARGET-001",
      "statement": "A pinned nRF Connect SDK/Zephyr toolchain shall produce, flash and exercise a NINA-B302 target image implementing the host-reviewed gesture and protocol behavior.",
      "verificationMethod": "Record toolchain lock, clean target build, image hash, flash log and hardware-in-loop results.",
      "subsystemIds": [
        "SUBSYS-FIRMWARE",
        "SUBSYS-ELECTRONICS"
      ],
      "gateIds": [
        "GATE-TARGET-FW-001"
      ],
      "status": "defined"
    },
    {
      "id": "RECEIVER-001",
      "statement": "The receiver-effects runtime shall be a direct paired BLE endpoint with its own NINA-B302, keep eight isolated device/session/channel slots, map the eight gestures to eight media effects and default to media-only authority. It shall accept Legacy V1 only as exact 2-byte channel-0 compatibility and Multichannel V2 only as exact 14-byte explicitly authenticated profile with ARM_ACTIVE and device/session binding.",
      "verificationMethod": "Replay the bound host build, CTest, cppcheck and source-hash inventory, then run cross-device/profile, negative-security, timeout, slot-isolation, safe-state, display/audio and no-dangerous-output hardware-in-loop tests on the versioned target and board.",
      "subsystemIds": [
        "SUBSYS-FIRMWARE",
        "SUBSYS-RECEIVER"
      ],
      "gateIds": [
        "GATE-RECEIVER-FW-HOST-001",
        "GATE-RECEIVER-001"
      ],
      "status": "tool_verified"
    },
    {
      "id": "RECEIVER-PCB-001",
      "statement": "The independent receiver-effects working PCB shall remain a 50.3 mm by 42.3 mm, 4-layer direct BLE endpoint using NINA-B302-00B-00, TPS62162DSGR, USBLC6-2SC6 and MAX98357AETE+T, with the external Waveshare 1.28inch GC9A01 SKU 19192 display and XHXDZ 30MM-4Ω3W-TFHM C50387216 BTL speaker. Existing receiver CAM is REJECTED and PCBA is not authorized.",
      "verificationMethod": "Complete the power-width, bounded-neckdown, plane-entry, return-path and CPL-origin rework; rerun ERC, native DRC, unconnected and schematic-parity checks; then regenerate and hash-bind a new bare-board CAM package before any upload. Keep the hardware/HIL and PCBA gates open.",
      "subsystemIds": [
        "SUBSYS-ELECTRONICS",
        "SUBSYS-RECEIVER",
        "SUBSYS-MANUFACTURING"
      ],
      "gateIds": [
        "GATE-RECEIVER-PCB-001"
      ],
      "status": "defined"
    },
    {
      "id": "PCBA-001",
      "statement": "No PCBA or production build shall be ordered until exact BOM supplier/LCSC mapping, substitutions, CPL origin/rotation, component availability and assembly constraints are complete and independently reviewed.",
      "verificationMethod": "Review a versioned BOM/CPL/assembly package, supplier mappings and assembly DFM evidence before enabling PCBA or production release.",
      "subsystemIds": [
        "SUBSYS-ELECTRONICS",
        "SUBSYS-MANUFACTURING"
      ],
      "gateIds": [
        "GATE-PCBA-001",
        "GATE-PRODUCTION-001"
      ],
      "status": "defined"
    },
    {
      "id": "PRODUCTION-001",